Unnamed: 0,business_id,cool,date,funny,review_id,stars,text,useful,user_id
1853,v8-d4GjT_sFiC2RXb3UJSg,0,2015-09-24,0,HFGdzXNdBsLuLJPB7Fy1RQ,1,to expensive for what you get ! i'd rather go to 31 flavors!  to me they are  the best. my daughter talks me in to go once  in awhile and i'm always sorry!,0,uU_ol_n14rgh8kuuZ--WSQ
1854,4Af-CW_Dn0LxmcBbs8eA8Q,0,2015-09-22,0,NBzc87NZ1J6Td_VGICa_oQ,5,jim has always been good to me and there have been times they haven't charged me. they are about half what other shops charge.  i live at 19th and cactus so it's out of the way but worth it!  my ex husband even goes here now and my daughter.,0,uU_ol_n14rgh8kuuZ--WSQ
1855,BXSKs02psOB24y9c0OGTvA,0,2015-09-21,0,MVIkH3GqfOYfDdS_WjaowQ,1,very disappointing used to be the place to go all the good stores are gone for my teenage daughters. and there's a lot of gang bangers hanging out not a fun place to be any more  i'll make the drive to either arrowhead mall or pv mall,2,uU_ol_n14rgh8kuuZ--WSQ
1856,UqhVZYUeoBGroYpZB-9jlQ,0,2015-09-21,0,goO-cujQZ4K6S1T1sJUJFw,3,it's ok but the drinks are expensive and i've had more fun other places.  the food is good. if i were going for the bar experience i'd go somewhere else.,0,uU_ol_n14rgh8kuuZ--WSQ
1857,7ALNJcSA_GRpznrDOtaOtg,0,2015-09-22,0,R2jt82XkbYi0f7eo0oretg,2,i hate the pharmacy you have to walk in wait in long long lines and when you call in refills you get a busy signal!  i'm going back to cvs or walgreens!,0,uU_ol_n14rgh8kuuZ--WSQ
1858,_B3jnaQVtDXqydea1y92fQ,0,2015-09-22,0,tqlaoiBpP5cKIRzY0vLPVA,1,i had heard about the new steak house and thought i'd try it. it was packed but i was alone so i thought it might not be that long. i wasn't welcomed and when i asked i was told it would be 45 minutes!  it was extremely loud and there was no where to sit i waited 15 minutes and the noise made me decide to go black angus where i didn't have to wait and it was a much better atmosphere and after reading comments better food too!,0,uU_ol_n14rgh8kuuZ--WSQ
1859,AF-N6i0XCJRPFFOZKp1Pnw,0,2015-11-22,0,fA0K2d7vhwW0aGIohuP2kA,3,i just went back and they had put green beans back on the menu but it is still high 9.71 for 2 ck and green beans.    what happened to the green beans!  and baked beans no one wants the nasty cole slaw! and the prices are to high haven't been to a kfc in year because of that,0,uU_ol_n14rgh8kuuZ--WSQ
1860,cxlxJpw_vTzw7bXJq6Dbsg,0,2015-10-04,0,c84vUkbCGMkcof5JCel5Dw,2,went in for the clam chowder and they didn't have it on a saturday night!  give me a break! and they are still pushing that nasty all you can eat shrimp!  no thanks!,1,uU_ol_n14rgh8kuuZ--WSQ
1861,h6neYN7OZVt9_ok2bAx6BA,0,2015-10-30,0,be73cK5HBOfEzJVhHV5AAA,5,i just got here after trying to get dinner at my mother's and they were supposed to be open until 10 and they couldn't turn off the open sign fast enough so i came here   the food was good close to my house and not expensive,0,uU_ol_n14rgh8kuuZ--WSQ
1862,oRBIgTHfNDritzEP5pvfRQ,0,2015-09-25,0,HHWTp0qBNTPRHcsTwF24Cg,1,i quit banking with them yrs ago because they charged for every thing even talking to a teller and i had thousands in the bank so a balance didn't matter,0,uU_ol_n14rgh8kuuZ--WSQ
1863,d1PsrEtEdlD9Q4QtWHXrkA,0,2015-09-26,0,nBc0VZuz9Lr30i347KaqeA,1,my daughter and i came in looking for dress shoes that they had advertised and they were rude and didn't even have them! had better luck at focus and they were nice and same shoes for 45.00! when my daughter gets married we won't come here!,0,uU_ol_n14rgh8kuuZ--WSQ
1864,CJZm1-WJFxNI_HE6P-n8Aw,0,2015-10-09,0,cL0Y01L5sU120lTY3gN-Jw,3,i read the reviews but i'm  stuck because of my insurance!  the wait  was bad the dr was nice i've been waiting for paper work so i can go home  for over an hr! that's why the 3 and your  correct they don't check on you!,0,uU_ol_n14rgh8kuuZ--WSQ
1865,ykSRyy7X8EwP92X11cA82g,0,2015-09-20,0,jCXcHkA2azzr9bKWYdw_Yw,1,they tried to tell me i needed to ?eplace a new crown and then we're going to charge me more than my insurance said for a cleaning now they are billing me for a cleaning they didn't do!  i have reported them to the dental board go to aspen dental instead!  they are crooks,0,uU_ol_n14rgh8kuuZ--WSQ
1866,i4hvmTd4RH9HvOyG8ndYGw,0,2015-09-21,0,TIvdLXA_5ph4ld4-rlc74w,5,best pizza in town!  i live at 19th ave and cactus so it's a drive for me to go but it's worth it.  i've been  coming here since i was in high school and i miss the old man  who used to run it but his son took over.  i've never had a problem here and have carried  out and eaten in its a great place!,0,uU_ol_n14rgh8kuuZ--WSQ
1867,Do72DKBclgkSPt6jZ9-c4Q,0,2015-09-21,0,Hqy77FUl9dekdrPQgC9qLg,1,i waited forever for a table then even longer for my order. it took over thirty minutes to get my check and it was over priced!  i waited so long for my check i actually thought about just leaving!  it was the worst  experience i've ever had i will never go back!  i miss native new yorker!,0,uU_ol_n14rgh8kuuZ--WSQ
1868,jvwzhzA9vsfJHCdlbLkHZw,0,2015-12-04,0,PUlnunkRcHNxCruQr5e6CQ,1,i've been coming here for 24 years i didn't know that they changed ownership!  they took the pretty art off the wall wouldn't know where you are by looking no art at all looks like a bar and they changed the almond clicked it comes in big chunks and the vegetables too and they charged me for hot tea! won't be back,0,uU_ol_n14rgh8kuuZ--WSQ
1869,FxKKhsjjPNNH3KWz8TEXaw,0,2012-03-05,0,Ha1Y60M-wcEwrKrQhB39Rg,1,veggie burgers suck. decided to try something new today... i totally regret that decision.  we got two different ones and they are horrible not to mention they took 20 minutes to get out and there were only two other tables there.  i won't be visiting there again... ever,1,0NPrqbR3r34jlLuGXNcP5A
1871,v1AE1LLWDOqe8ubOzqKADg,0,2014-04-12,0,2znqu_Oe8HmO1vWrMHItdg,4,came here based on the yelp reviews and i have to agree. the service was great...i had the classic french toast and they were delicious.,0,zr3d9JdYSBJ0fIJefOqOsQ
1873,kd2kHMQTDQPjuBTO5nFHPQ,0,2017-05-11,0,kVzGZ-qJaLeDmIAs0Au-Wg,1,for the love of whoever you believe in .... just don't. keep looking for a jeweler. i promise you you are not missing anything but headache. from low balling gold you want to sell or not replacing a diamond that fell out of the setting in less than 6months after we purchased it ..... to ruining 2 watches during a battery change. oh and they do it all with an attitude. good times,1,e3YM3m028zXc8ai2ZsgFgw
1874,9Zhiktm7_LYN_uxaT9XEhg,0,2017-03-12,0,R742cDU7ivlg0XnjEtkvZQ,5,we adore this place! we only pick up so i can't speak to the dine in service but it's great when taking away. the food is fresh and seems of higher quality. i also don't notice the excessive sodium that i do with other asian take out. the sizes are large but not so much you waist. i also like the containers the food comes in. all in all it's our new place.,0,e3YM3m028zXc8ai2ZsgFgw
1887,l4SRHKV2XLdUR_QpvVxI1g,0,2014-04-13,0,qixQN-RZpiqr5RRihEgLGQ,2,i would not recommend this place. you never know what you'll get at this restaurant. the service is okay but they always seem irritated and pushy. i'm not sure if management understands this or cares. in my opinion i wouldn't choose this place for a party or reservation because you'll get less than what you pay for.,0,HEoo4q1XNOeyEXiPOeoHQw
1895,5REYrZfsX3m4E3FTwovp5Q,0,2016-09-04,0,q-bIPx6aMpz03L_XAMhCWA,4,i'm writing this review after about 5 meals at seviche.  i highly recommend it to anyone looking for a deviation to the standard american fare.  i'm usually with 1 or more friends and we order a number of small plates.  it's fun to share the experience - and the beer and mixed drinks are a bonus.,0,1tc3YTz-yyHqLkkdQtJqDA
1899,Uq-GOs9_IqweUsB5MdII9w,0,2014-09-21,0,UCvnMF2cRpMlDRTzgpExHA,5,got a free breakfast!! they quoted us 15-20 minutes however the wait was around 30 minutes. so when we sat down they offered us a free meal. great customer service :),0,zTACXC5j-v59WrP_3k6ZAA
1914,xpJEBXTCQh5Ib8BJrjt9Bg,0,2016-02-06,0,GeHvs07G_E6nrq0712YH1w,2,mac and cheese poppers look good but taste bland. veggie pizza that's $16 is made on a thin pita bread- cheap as hell!! come for the beer only :(  food left me craving something tasty...,1,0qpDh40Kvk85Veuv4rHKQQ
1928,pJlHbIoePemy_wQVpWTR2g,0,2013-09-23,0,YrvCFQdYdz-7iTPSbz-KGw,5,good fast mexican food right on green st. they make their own hot sauces and have margaritas and jarritos and horchata. friendly guys behind the counter if you like futbol it's always on.,0,qnMR9YDAZuWP1ufBM_pKhg
1937,L2DONYpn0IjFvVGaZ9bZpg,0,2015-05-19,0,VVH-ob1Zq6IOaC9psr0RPw,5,i really enjoyed my limo service with bell the driver dave was sure pleasant and knowledgeable about the area . i will be checking out on thursday  and we have had a blast here.  will call bell again. thank you,0,cIOG8YUui6r4cMaxzDFBfg
1939,9vG7UBYjYLDNb3VS1EZqEw,0,2016-11-08,0,dAL1NleAVIaqDGxp_mlhpg,5,if you have never tried laser or are just looking for a laser place look no further than simply skin! this place is amazing from the staff to the laser. i moved from california and was in need of a laser place and i stumbled upon simply skin. i was nervous but it has been the best decision i have made. they are super nice there and make you feel super comfortable. let's talk about the laser machine now. it is painless and has gives you results!,0,UQnP-Qpt8GUouWaCi9V30w
1940,YrKjO9jFZrsgpIbSSLSHRA,0,2018-01-02,0,WYUgKU6j7SP8PCXHHB4itw,1,avoid this place and avoid hairstylist irina!!! save your money. i asked for layers and my hair was butchered and uneven! this is what i ended up with. who cuts someone's hair like that! i also had my bottom ends dyed grey and no grey was noticeable. i ended up with orange/copper hair. i called to speak to the manager i was told i would have to wait a week to speak to the manager!  wtf!,3,UQnP-Qpt8GUouWaCi9V30w
1941,RFXvcu83or4KG7mcjWaUKA,0,2016-08-03,0,TmoDDrtQ-aURU1c3rqRCHQ,4,overall very good experience at the store. rep was helpful in walking through the item i was looking to purchase. had discounts with the bestbuy program as well. have the product installed and see it working like a charm.,1,qkwlgXLO5HtqrtA6-HN4ZQ
1943,iKMLsX1Je7P3wAOEc9scDg,0,2015-09-09,0,JpcIJjTX7tyMMq79PQMyEQ,4,came here for brunch.  everything was very tasty - deviled eggs are outstanding and the salmon equally good.  service was quick and courteous,0,aBXJK7fk2GDhDmgJEKiBeA
1945,kYD9E14AijONhJ7rFsyLrg,0,2015-04-11,0,_qSZqFuPeRhFX9TKv7DlKg,5,we came here for dinner and the service was outstanding and the food was just excellent.  this restaurant is a hidden gem!,0,aBXJK7fk2GDhDmgJEKiBeA
1947,_BnBjRMt5Ba-TAv07r3fyw,0,2015-11-14,0,UjxKe9a9tdGHC1iCfSOaKw,4,service was outstanding.  i ordered pasta arrabiata and it was quite good.  the coffee is very good here too along with the pizza crust.,0,aBXJK7fk2GDhDmgJEKiBeA
1948,dsIHIXyAl_ldqkd8QekvTQ,0,2015-11-14,0,r_2zT5Jw9GGQMFCxP9ps7A,1,i walked in here to try it and had a greenhouse juicery bottle in my hand and i was asked to put it away.  please.  i was immediately irritated.  in no way was my juice going to take away from the business i gave to you - until you said that.  then i ordered less simply because of the rudeness.  your food is nowhere in the same league so you should take whatever business you can get and be glad anyone stops in.,0,aBXJK7fk2GDhDmgJEKiBeA
1950,UH6mET5JYZR6yPDVpTG9Og,0,2015-05-22,0,ETxzxCzbn4yap2tllojINA,4,the turkey meatballs are delicious!  nice atmosphere and good service.  we'll be back!,0,aBXJK7fk2GDhDmgJEKiBeA
1952,UxWH8zRYIBgs6Q2oykvRdw,0,2015-09-09,0,r35AtF1luGvnojz7js615w,3,came here for brunch and had the mushroom and artichoke omelette. it was very good and served with a small salad. very nice atmosphere.,0,aBXJK7fk2GDhDmgJEKiBeA
1953,a8pmtlVKf7NiSLI-4KejIw,0,2015-08-01,0,-mKxNOVHiQQhDpteGtH1pw,4,nice place to eat on a patio in the summer.  we ordered the guacamole which our waiter said was the best.  i wouldn't say it was the best but it was quite good.  our dishes were also tasty and we didn't walk out of this restaurant feeling stuffed (unlike most mexican restaurants).  the mojitos are excellent.,0,aBXJK7fk2GDhDmgJEKiBeA
1954,tEfmHuo_dNanyTaC5PyoOQ,0,2015-11-08,0,7MBS2ZSO0Lcx4GwOasyDGA,3,food was very good.  my friend had the torn pasta and i had the roasted pickerel.  portion sizes are good and you don't feel stuffed after the meal.  for some reason i didn't think it was fantastic though.,0,aBXJK7fk2GDhDmgJEKiBeA
1955,5nie8WoCB-MpEYT5uE6t4A,0,2015-11-22,0,qUg0mKZBlbmqHGMpfvKlxA,3,came here for lunch and had the spinach salad with salmon.  i substituted the creamy garlic dressing for a balsamic vinaigrette.  the salmon was very good and the salad equally tasty. reasonably priced for lunch and not a massive portion - just right.  atmosphere is just average.,0,aBXJK7fk2GDhDmgJEKiBeA
1956,6md5a6HzI8oKkBTaOecygg,0,2015-11-15,0,PAwIQc10vVpnedCA33R1SQ,4,this restaurant has a great ambiance no matter what meal you are enjoying or even if you're just having a drink.  i've eaten breakfast here as well and everything was very good and the service was great too.,0,aBXJK7fk2GDhDmgJEKiBeA
1957,tqgDsKlKdH73HVs5jxfemw,0,2016-02-21,0,t3SECSreDW24T4al2ppJHg,5,love this store.  all of the best brands in one place including some very unique ones you won't find anywhere else.  the best women's clothing boutique in toronto!,0,aBXJK7fk2GDhDmgJEKiBeA
1968,wgoCMZXYoIj2vcxB4GjePw,0,2012-06-15,1,-OMLGmPZFWzfCkSUSVV6CQ,5,best poker room in arizona. there are big screen tvs every where.  food is great and staff were friendly.,2,G2XNBerSAEzfLiSPaPY-Rg
1971,7VMQOcu_ZitkulsDsvegZw,2,2013-09-16,0,nQrMfkrvASlcJfACj8Phtg,4,i received a competitive price and good install on a kenwood head unit.  i would go back.,4,46UF55A26vVfChgAsACM5g
1973,ireHTdAh1d4lmGiieMfV_A,0,2012-11-11,0,A1DJ_VhRUMLqbLlWcrIQjw,4,bailey's is a great place to hangout and play some pool and have some great pub food.,0,46UF55A26vVfChgAsACM5g
1979,D2ojX9bvE0_-aIj9BhdZZA,0,2013-09-29,0,AxHK5OzqvWnMwcI7YJBkBA,4,the wife and i enjoyed our lunch very much.  you will receive the freshest food here.  the pimiento cheese spread is to die for.  try the shrimp blt panini it is fabulous.  if you like burgers give them a try too.,0,46UF55A26vVfChgAsACM5g
1983,v1DdKUcs-KxR3JV_vE8nMg,0,2014-12-04,0,qfuEMceYiB1IzhZkFSwpgg,1,if you are female i would not recommend this place!  stay away service contracts etc added in after being shuffled through 5 salesmen!  really it is the epitome of the old car sales place!  if you like that sort of thing this is your place if not there are so many other places to give your money!,3,Xu6kxX18Uv14MSZTY7PSgw
1984,xmgLfJ5Jo6hHjY61hzO_EQ,0,2014-03-13,0,1dartEoF9n7-Fcgx7DWilA,1,went on a sunday and the gal did not use sanitised tools!  ok if nothing else the cheapest thing is to be clean!!!!!  it takes one time to get some kind of infection and lose a finger.  i think the owner was not there that day so i hope she reads and takes care of this problem!,0,Xu6kxX18Uv14MSZTY7PSgw
1985,xkiYAerQQXL25legNhVsSw,0,2015-04-26,0,cIyDRhWeHtZ_pDQBe4sG8Q,4,the pizza was ok and the chips as an appetizer were good. anna our waitress was very pleasant and did a great job!!!,0,zdG-3ABz7-mv1P3cs2_Rfg
1986,deipWwvNQm5DMmfpq9tNoA,0,2015-09-08,0,tYmdSXu5_cAHrTG9W3e1Ow,4,pretty awesome thai food. can't say more than have the fresh and spring rolls and as much pad thai as you can get your hands on!,2,Yp0KIKTlQBlyID724QKDNw
1990,XS80QAi1aYKK5v1zmKlkwA,1,2015-09-02,0,qPJb_4nNnG8bNgdVVPL6fA,4,great quality cheap and cheery sushi. the dragon rolls are to die for. but the chirashi needs improvement,0,Yp0KIKTlQBlyID724QKDNw
1997,2mKFNjIEktW2Nl1yV2cj7g,1,2014-07-18,2,bSSPOvfoM_ghNZ-9bop7wQ,2,e,1,Yp0KIKTlQBlyID724QKDNw
2000,YAJzBGvqT3dT_qAg6u8E1A,0,2015-05-05,0,EFTppzlh9Kt4pyBRbpVAOg,5,awesome burger; perfect tacos and also the grilled sandwiches are pretty good!,,
In addition to that they have the best fries!!!,,,,,,,no review,,
Prices are very reasonable!!,0,kqLeLZhLUt8N5ZGpHUAxFg,,,,,no review,,
2002,mtQ7Uc-j2muK0AyVQTT9fQ,0,2016-11-10,0,z_1A5Io1qD_xMBt5df45TQ,5,food was amazing chicken crispy full of flavor mac an cheese best i have had out of all soul food restaurant i been the customer service was awesome they gave me a sample of sweet potatoe pie ended up buying 3 was truly mouth watering i will be back for sure highly recommend if u want food that taste home-made will be back for sure....,0,GESMvmak7oGs5sQwJ1V8ww
2003,vOyZkFAknjVg-Fwye3TKaQ,0,2016-08-14,0,f4hFQG0lfmnFMKqZ4iyphA,4,my wife and i really enjoy coming to pita jungle for lunch and dinner.  the seasoned chicken and hummus is one of our favorites!  service staff is always friendly and helpful with meal suggestions.  i would recommend!,0,CSs6Gs-k0x_PdnzShgOFsg
2006,I22wQGTkLFGn6jTOhwoecQ,0,2017-01-15,0,AUVlbDD4k8GoxbPycEBs_Q,5,food was very authentic and excellent! best carne asada that i've ever had. if you live here or just visiting i highly suggest this place.,1,8Cvdf7-zeGPkcv8afQ58wA
2007,py85NxzGJTNfeQvqrKY_GA,0,2014-09-18,0,y2uPL4NauaY4YBR4vPgc7A,5,beer selection is awesome and the employees were very helpful and friendly. i would highly recommend this place if you need to purchase any grocery items.,0,8Cvdf7-zeGPkcv8afQ58wA
2009,cgbwniQdmHwVxjdyuTm9vA,0,2011-07-23,0,lG356_iBk1pHyNfVh9_Csw,5,hier lohnt sich das warten!,0,dwx0oafyJ_CPa_mEjO_I7A
2012,KjV_68oLLSpqR96VnV68tw,0,2014-04-26,0,IcWBYf4oXSb27EMxoADLmQ,2,first of all when you go thru the drive-thru they dont greet you at all. there food is also very greasy. and when your done ordering they never tell the total. how are we supposed to know how much the total is if they dont tell us.,1,SQm5TEeF_tP9QJKg1HAN6Q
2013,WQyGqfFKd-baBTVfZWzeTw,0,2014-04-17,0,oTj5rY-WQpfb4heIFFdMvw,5,this place is awesome. lots of variety. lots of different candy and sprinkles n even strawberrys. they should add more chocolate yogurt that would be nice.,0,SQm5TEeF_tP9QJKg1HAN6Q
2014,riFzCvp77DMKDX-5GoTpqA,0,2014-04-26,0,nBSZLacee6NaPuCKRf4lvA,3,the first time i came here i loved the oreo shake. but the second time they messed it up. it didnt taste like it did before. they also have the same shakes everytime. they never change the flavors or make news ones like other restaurants do.,0,SQm5TEeF_tP9QJKg1HAN6Q
2015,LNGBEEelQx4zbfWnlc66cw,0,2014-04-22,0,4YSIJYcQj6143WyQE1ID0Q,5,absolutely the best buffet i've ever been too.. so much variety. first time i went there is like almost 4 dozen shrimps. the m cider was pretty amazing. the best part was the desserts. they so many different desserts waiting to be eaten by me. love the different types of ice cream as well.,0,SQm5TEeF_tP9QJKg1HAN6Q
2016,LwXo16VrGPhhOWc_Wj7ifw,0,2014-04-17,0,2Wm9_ytkF_56LfFbCqk0ZQ,5,i have to say wow it completely blew me away. i ordered the chicken tikka and naan today. the chicken tikka was the best chicken tikka i ever had came with bell peppers and onions with masala on it. and the naan was so good. everything was fresh. they make it right in front of you while your waiting. i would definitely recommend this place to friends. this is my new favorite place to eat indian food.,0,SQm5TEeF_tP9QJKg1HAN6Q
2017,ccd6w9w81PUBmtV1DFXgig,0,2014-04-26,0,gecyhWEXzzmtQJ8fIaspjw,5,love the sonic blast. doesnt matter which sonic blast you pick they all taste awesome. the slushes are awesome. very cheap too $1.08. but the only problem is that with the slush is that it dries up after your done drinking it so it becomes all white.,0,SQm5TEeF_tP9QJKg1HAN6Q
2020,4JdoQ95uXy__zoHmPhtdiA,0,2015-09-21,1,ZHtkLaMn_fQxskFAIqCVog,5,heard about hydrocare thru a friend. came into town to get my house ready to sell. called michel. no problems. set the appt for sunday for carpets and a large sectional. awesome service. everything came out better than i expected. michel showed me his grout and tile cleaning process and i was sold. so that performed this work all on sunday. amazing job. michel and patrick are great to work with and i would def recommend them to all my friends.,0,jH7agfowlP9TbXQHApyMxg
2021,X1twjafYxMCpKt2MqvY5Tw,0,2016-07-11,0,diQy3vHanT2s9qfKSE9m0w,5,great little hidden place so you might be skeptical. but once you walk in they have great friendly family style service.  fantastic food with fresh ingredients at a good price.  glad i randomly stumbled upon this place.,0,FhFMPorNb5A4PdTUXRUj2A
2026,Tjbd3oTRXs9ZdItF_cLJMQ,0,2013-02-13,0,OifPxoCV9YqLivhrfMi6fA,1,by far the worst gel manicure i've ever got. just eww. glitter gel was not even. thick as hell. not shaped well made my nails look deformed. aaannndd this part is just sad funny... one lady did my cuticles and filed.. when she was done another lady mimi stepped in to do the gel while the first lady stood behind her and watched. i don't know what exactly they were saying but it was pretty apparent that she was teaching her how to do gel. lol. aren't you suppose to go to school and be certified to do that! not to mention she's being trained by the worst nail technician i've ever met. don't go here. oh and another funny.. while i was there fedex guy came and delivered a manila envelope that required signature from a law firm. maybe they will be shut down for their fraudulent nail service and no one else will have to experience such bull. the files were reused the cuticle trimmers didn't seem to be sterile the tray had nail dust on it ugh i could go on and on the more i write the more upset i get!,0,uRfrT_ZiL7COPvji4YZpnQ
2034,R5sfMJeNBARIOT9OevJLkA,0,2016-07-29,0,hiDqMNV9daG77k8PwQU7iw,1,worst company ever! the product is soap and water! this product is so expensive and is a waste. try and get some customer service and your screwed. all they care about is the commission so once your card is swiped forget about any help after that!,1,8UPnHtRqG-xJJBYXMN3LPw
2035,GTuAPBRsM5dVPqPy9oe14Q,0,2013-08-27,0,x0kflqvNvG82bu0N1fvoJA,5,the cheese steak with sauce & onions is almost as good as the chicken salad; which rocks!,0,pQEKiZ_76KtpRVtIlHCzFg
2036,G-5kEa6E6PD5fkBRuA7k9Q,0,2016-02-14,0,-Hr48Svv_aPOJMO2tgEbyw,1,we are locals and 2nd time here...first time was awesome! looking forward to our 2nd time but very disappointing. especially on v day.  the veal was extremely dry and the sauce didn't help...so sad.,0,JCB38-kGiyPmxeGSDsFytA
2046,nqiTujxNtEpA8dPATEQRrg,0,2016-08-31,0,DNfAwVJJG1knqPSVZwlIQQ,4,four stars for the service. grace lived up to her name. gracious and patient. it was as if she is an actress. hope we'll get a chance to return.,1,ZdUFyF5eNyZxete-T4bmZA
2055,4-ErDo1ggAg0DWrVwPa-IQ,0,2016-03-25,0,8EtxuCP_fpaq8t0wxKKnFA,5,loved my visit at clear vision! all of them are really nice and they know exactly what you want when picking out glasses!,1,qfd8RzFnl3gZgathtm6yqg
2059,tixO3aKYU99KCFaRKm7Cjw,0,2017-07-02,0,nSbxCknKPLL_sQSfohIbeQ,1,i like the previous reviewer had same issues for scheduling and overcharged on estimate . owner told me we would do remnant but than ordered. to top off his inept staff made a pipe leak in bathroom and leaked through ceiling to bottom floor on top of furniture that was soaked. it was horrible. we went and talked with owner and said he'd look into it and never called back or rectified situation. now we smell mild. worst company ever.,0,Pvvvi8d9JHOa0DEjFe05Cg
2060,B5E_Qp3R1q0oRlzbYaWIkQ,0,2016-07-11,0,54Als0ek4EPUDXhokp4A9Q,4,i have eaten here many times and it is always so good. the noodle dishes are soooo good my favorites are the pad zu and pad thi they are both my absolute favorite things to get. when u go there ask for the server leilani because she is great! she is sooooo nice and she makes great recommendations i also love how clean and tidy they keep the restraunt,0,SdxNjQk0I4qefOsKfJAz1g
2061,7o61DDMJ1noIlDbjY-McEA,0,2014-01-08,0,1SUm1hVjpozRjsdWzYsbxg,5,i just relocated back to phoenix this past november.  i was a frequent shopper at the ralph lauren store at the anthem outlets in the past.  i was completely blown away by my shopping experience this last december.  the store looked amazingly clean and well organized.  i had the best time shopping there christmas time.  thank you ralph lauren!  i will be a frequent shopper in your anthem store!,0,UHHH54ywACV68MlNDO3x6A
2062,p6YA-77VayfRsm-QdBlUJQ,0,2016-09-25,0,5A88eUwQRCv7xMJ4FTFLIw,5,she was amazing!! very accurate she definitely have a gift from god!!! thanks lily!!!!,0,pQSpJukPH5QmvebFHgJc7A
2068,7yYexN1Q5ShE_z1MH2TDTw,0,2016-08-21,0,4do95uO6Xi9Z9l5kHrDUSw,1,awful customer service. lady was rude when we got there. left us standing at the counter to order for five minutes. came back and didn't ask if we were ready or  anything. when we finally got our food my burger the animal was over cooked and my oldest son's(10) chicken basket was under cooked. needless to say he got food poisoning. my older brother recommended this joint. i was not impressed either by the certificates they had displayed from 5-6 years ago. i will not return ever.,1,uypTljdvpVpU4A_3eRRmUQ
2075,_pBXtjN43eqMV0XZTz7nmw,0,2016-05-16,0,WdzQPQeWLLMdIH6sXRRFcg,1,the bouncers and staff were such assholes we left and went somewhere else. ruined my friend's birthday.,1,zKOIrTwR7HCYfi05ce1-qQ
2076,wizwRqaukMKVNSf8IFZCYQ,2,2017-08-11,0,9uOHpeu3eeqTfUrzRLFzPg,5,what an amazing way to spend part of the day!!!  top class service from start to finish!  really happy to be able to go!,1,XR7DMCO0C7McsLuS8mpvow
2080,_OTl6V2oUfMMmoDWD2nXVg,0,2014-07-25,0,7yKlf1W-vVFK1TmORRLNZQ,4,i purchasd the italian bread- it was delicious. better then any other gluten free baked goods i've had from whole foods.,0,a_ysP4XsxQjHGeYcHasVgw
2081,Dnn7JsdmvJ0_spWu9wo2kg,0,2015-01-21,0,g7j-44IT0zfanWtwOcKaYw,5,first off- congrats chef piero. my co-worker and i shared two sandwiches the cuban and american(the american version of an italian) both delicious.,0,a_ysP4XsxQjHGeYcHasVgw
