Unnamed: 0,business_id,cool,date,funny,review_id,stars,text,useful,user_id
- There is definitely an outlet at the back corner. I didn't look anywhere else, but there is at least one!,,,,,,no review,,
- There are vegan snacks, soups, sandwiches in addition to several nonvegan options.,,,,,no review,,
Complaints: ,,,,,,,no review,,
- None really. It's a bit out of the way for me, but I would go back anyway.,9,YgavGxfAdjhkkbwlAY_9ZQ,,,,no review,,
1880,T7yKffTuhiIZclsgjfgowA,0,2015-06-06,1,gro-IODI77cuvEoXZfAAjw,4,the margarita pizza they have with a soprassa-stuffed crust changed my life for real. one of the best neopolitan style pizzas in the city. the rice balls are also my jam. staff were attentive and had lots of personality. i'm not even italian at all - but it made me feel like i was at my nona's house!!,,
A homeless lady came in and stole a loaf of bread when we were in line, props to that lady! Gotta give credit to Via Mercanti as well for feeding the homeless.,0,c7YlnErSRpkD7fnrCw_a6Q,,,,no review,,
2344,HhVmDybpU7L50Kb5A0jXTg,0,2017-06-21,0,H0IjrmTpYHwfhtStQ2fZwg,5,come hungry! huge portion. outstanding service. if you want great nachos, come here.,
All we needed was two more people to eat it all.,0,8HMN1jABE5y7my-B8m62Cw,,,,,no review,,
3235,HVpwpXneaCWMeEBF7H8jpQ,0,2017-12-31,0,UVO_X4hssszf67h4UgEgPQ,4,decent prices for street food. the seating area is somewhat limited during peak dining times. it really irks me when groups of people come in and snag a table before ordering despite the long line. the seating issue would probably be better if they had a rule to order before sitting.,,
Pork bowl was really good. Coffin toast is cute, but I was expecting a more robust flavor. Squid balls are a nice side.,0,Q7KAsXblnS5rWGAeHzLmJw,,,,no review,,
Seriously though, O.Noir is easily one of the worst dining experiences I've ever had in Toronto, not just because the food and service were awful, but also because I left the place feeling ripped off. O.Noir took a concept that could have been interesting and did absolutely nothing with it. It was nothing more than eating crappy food in a dark basement room with the lights off.,,,,no review,,
First off, the food at O.Noir is horrible. It's just glorified, hotel banquet food. You know the stuff: salad with balsamic vinaigrette, pre-cooked steam-table-held vegetables, chicken with coriander sauce. It was all of those boring old courses served at weddings and buffets in the 80s and 90s; there's nothing imaginative going on in the kitchen here. The food had absolutely no bearing on eating in an environment void of light. You'd think that if they were going to block your sense of sight, they'd want to serve food that would heighten your other senses, like food with strong aromas or flavours. Nope. Just unthoughtful,crappy food. in a way, the food was so bad that I'm glad my other senses weren't heightened by the lack of light.,
I ordered the 'surprise' menu. I mean really, why wouldn't I? I'd like to at least try to see if I could use my 'enhanced' senses to not only guess but also to better appreciate whatever it was I was eating... For me, the 'surprise' was that I still don't know what the hell I ate. No one ever told me. I sort of assumed that once we were finished eating, the server would have at least told those of us that ordered the surprise what it was we ate so that we could confirm our suspicions, but nope, he just took our plates away without any explanation at all.,,no review,,
Speaking of our server, he was one of the worst in the biz. Not only did he not bring us anything to drink until we were finished our first course and constantly get our orders mixed up, but he was inattentive and bored; I don't blame him though, it'd be hard not to be bored down there in the dark dining pit of O.Noir. He often left us wondering where he was, not because we were in the dark, but because he often left the room or crept up behind us.,,no review,,
The seating arrangements leave you feeling bored and isolated too, especially if you're part of a group. In a dark environment, you'd be better off sitting at a round table so that everyone can be part of the conversation. Our seating arrangements at a long, rectangular table left those on the end of the table feeling isolated and alone.,,,,no review,,
Sitting near the entrance to the dining room sucks too. Believe it or not, the servers actually signal that they're entering the room by banging on the door. We must have heard it 40 or 50 times. In a room that is supposed to heighten your senses, this seems absolutely ridiculous. Surely there must be a better way to enter the room and make sure that no light enters. If there is, O.Noir didn't figure it out, or they didn't care. They just decided to stick with the loud banging.,,,no review,,
Although we couldn't see anything, a quick feel confirmed that we were using those cheapo hotel-style metal chairs and wooden tables. I mean, I know we can't see anything anyways, but if our senses were supposed to be heightened, then surely our sense of touch should be a part of that. You could argue that because you're eating in the dark, the restaurant doesn't need to spend as much on the space, but I'd argue that because you're eating in the dark,the restaurant needs to spend more on the space and everything in the environment needs to be taken into consideration.,,
On the way out, the bartender asked us if we were staying in the attached hotel, and right then, it all made sense to me; this place was taking up the old banquet facilities of the hotel. It explains the strange layout the dining room has and the trend of hotel food and furniture. It confirmed one thing for me: if you're going to have a restaurant where your guests eat in the dark, then the space definitely needs to be built specifically for that purpose. There's little doubt that because they didn't, O.Noir sees little repeat business. People come for the novelty, but likely leave disappointed.,no review,,
O.Noir offers nothing more than eating crappy banquet food in a dark basement with the lights off; absolutely nothing more than that. The pitch-black did nothing to make the experience better or heighten my senses in anyway. I was just eating crappy banquet food in the dark...,15,YHWsLBS8jzZiPjKHMFOaAA,,,,,no review,,
FYI: This form of chiropractic is not for those looking for a quick-fix!  It requires serious commitment, but I promise that the gain in your quality of life will be well worth it!,4,vc-VfW7-Q7JmHzA6bTLHyA,,,,no review,,
4906,5OZS7Sz7oX6XBL7KZE0G1Q,3,2014-12-15,2,eDnweUFyeVaZ86hH9FB5fA,5,as newbies to phoenix, we have been looking for a great Thai restaurant for dine in and take out. After eating at Jasmine Thai we are confident that this will be our spot! ,
The restaurant is clean, service was speedy and the staff very friendly.,6,DFkmpM9OXw_7DVhaKfCnrQ,,,,no review,,
2246,PgQZfKQwW6Q9fIvViD7Xrg,1,2011-09-22,0,20P4mGwJO3RQyfs_AN0VeA,5,the location is great! the prices are spot on and the environment is relaxed and comfortable.,,
The salad bar is fun and they have a pretty descent variety of offerings.,,,,,,,no review,,
The soups are always great. The chili which was one of my favorites, the chicken pot pie, the beef stew,and the tortilla chicken. Jasons Deli always hits the spot when you are looking for a quick and healthy meal.,,,,no review,,
I also LOVE that they have introduced their healthy initiative.. Yay Jason's Deli!! I am a loyal customer!!,1,hvZ5o9YNJJ-TVCcdT42VoQ,,,,,no review,,
Came here with my son to pick up an online order and to have him look at phones. I got my phone and that was that, no offer to help set it up or tell me about cool features, I had to ask. I could sense the reluctance but my phone was set up, then strong push for Direct TV and a home alarm.,,,,no review,,
No acknowledgement of my son who was looking at phones, whom I asked (in front of the agent) if he found something (he did). Still no acknowledgement, so we left. Will probably get it online or find a store more willing to help. ,,,,,no review,,
I miss the store inside PV mall. They were a 6 out of 5. Sad they closed.,1,0pf5VuzE4_1pwj5NJHG5TQ,,,,,no review,,
As for customer service?  Spotty at best.  Today the server behind the counter at the soup ask if I wanted any soup, I said yes, a small Tamato Basil.  I got up to the register (very crowded) and there was no soup?  The server of the soup had this blank stare on her face like did you want soup?  Then the cash registers were not working properly and we stood at the counter with our soup getting colder by the minute and 4 to 5 minutes later we finally got to sit and eat.  Only other comment (not a good one) is that the water out of one of the soft drink dispenser tasted very bad?  Not sure why but certainly something to be concerned about.  Well, that's it folks!  We live in Anthem and don't have a lot of great resturants in the ares so we are very sad that this place is seemingly going to hell in a hand basket!!,1,3PzZdVYJp2o-Fkx5TfcmbQ,,no review,,
1351,806kkDGaRCJ4lZLRcEf-iw,0,2010-01-25,0,9U-sJBLtm1USA9uqnJV6sw,4,i've eaten here several times now.,,
Really enjoyed the ramen.  Large bowls brimming with tasty goodness.   Note, some bowls have more meat and toppings than others.,,,,,,no review,,
Gyozas are also very good and appear to be made in restaurant as opposed to the frozen bought variety.  ,,,,,,,no review,,
Chicken wings were also very good however last time they came undercooked.  ,,,,,,,no review,,
I'll give that a pass as until that dish everything has been great.  ,,,,,,,no review,,
Very attentive service.,,,,,,,no review,,
Will be back again.,0,h2zLiqDXdA_sOdPFRGmM5w,,,,,no review,,
I enjoyed the space itself though, that wide open emptiness. My table was covered in magazines (so if you don't bring reading material, you're more than covered), they have wifi and I read and finished a book without interruption (it's quiet). I'd probably go back eventually, buy a coffee I might not even like, solely to hang around. Maybe that's why there isn't much seating, there is a certain dark homey comfort to this place I can't quite put my finger on,but i like it.,,
While I'm happy they offer soy AND almond milk, I don't like that they charge extra for it.,3,YgavGxfAdjhkkbwlAY_9ZQ,,,,no review,,
+ They're a hole-in-the-wall joint.  That means little to no traffic, cozy, fast.,,,,,no review,,
+ Simple menu.  It really bugs me when coffee shops have a hundred-and-one different drinks up on the board.  Seattle Espresso's menu does not mess with your mind.,,,,,,,no review,,
-/+ The baristas are average.  Most of the time I come in and they're friendly, but once I had a guy treat me like I wasn't even there.  His friend came in and they started talking... while he was making my drink and when I paid.,,,,,,no review,,
+++ I LOVE THEIR DRINKS.  Their espresso is smooth and blends well.  Their cup sizes are decent.  They have very unique flavors, my favorite being the white mocha.  The coffee experience here is sublime, to say the least.,5,dnSBTYaCnKk_zxjAic1QEQ,,,no review,,
3706,IMb5BpDLlSbr7yn19HhltA,0,2016-02-24,0,4CBuchBC7S1gZD8QfnGlvQ,1,the arriba mexican grill off bell road is fantasic, but this location is closer to home so I tried it out.,
We sat in the bar area and weren't greeted for about 15-20mins. No big deal, we order our drinks and that takes about another 15 mins to arrive. The server brings drinks to the table next to us and drops the entire tray of drinks and the lady behind me... I'm not talking a little water. The poor lady is covered in drinks. The server immediately apologies and runs off leaving the spilled drinks all over the floor and table. I kid you not that spilled mess sat on the floor for 30 mins before ANYONE came over. No manager came to apologize to the lady right away and all the did was give her a free appetizer! Terrible customer service, the manager addressed the lady as the one who got drinks spilled on. How about you learn some manners, sir! ,,,,no review,,
Anyways, after 50 minutes of sitting there we finally see our server again to take our order. The food came and what do you... it's super crappy tasting! I'll take my $50 for 2 people and go else where... like the Bell Rd location. This place sucks, so bad.,1,2A9ox9p8iodBVx20Dhr-fg,,,no review,,
72,SvlTuwslYKdqvqWtDe2dgA,1,2017-01-22,1,a6j2K8RuxCsg_fZ3El9PXA,1,food taste: 2,,
Time to receive food: 3,,,,,,,no review,,
Customer Service: - 5 (yes, that's a negative),,,,,,no review,,
Cleanliness: 3,,,,,,,no review,,
Accuracy of order: 0,,,,,,,no review,,
Liked that the screen is easier to read. Nice printed menus too. Purchased a Groupon  (4 burgers 4 sides) gave our orders (one burger and side to go) and was charged $26 and change. I'll take credit for signing and paying albeit confused, my mistake. Apparently lady assumed I only purchased a Groupon for (2 burgers and 2 sides). I pointed that out, she (lady 1) needed help and the lady (lady 2) who helped only asked the cash registrar for an explanation, not me. No sorry no nothing. Immediate refund of $21 no questions asked. I asked why it was only $21 not $26 and change, a brief and now obviously fake glance at the screen and I was told registrar was right not me. Lady 2 walks to the back and cancels 2 burgers and 2 sides. I patiently wait cause I understood the kitchen was busy and there was a line. I explained we needed 4 burgers and 4 fries again, no apologies for their own confusion and mistakes. Lady 2 just says the whole order needs to be cancelled and redone, again no apologies,didn't even offer to help further, just stayed in the kitchen. Lady 1 put in an order for the other 2 burgers and 2 fries (one to go) offered me 2 free drinks which I declined.,
Guess what came to our table. Yep, 2 burgers and 2 fries (you know, the one pair that was to go). Explained to the server that we ordered 4, again no apologies, checks with the lady 1 at the register and shortly brings our order to us. Fries tasted like fries anywhere else, crispy, plain. Nothing special like before. Burgers were bland,both my husband and son said burgers were 'ok, not really tasty like last time.',
As we're eating, I notice lady 2 walking and chatting to other patrons. She stop by our table to make amends? Why of course not. She looked at us though, and walked away.,,,,,no review,,
Last week I told my sisters to eat here. Just sent a message on group chat telling them not to waste their time. Few weeks ago told my coworkers to stop by here when they're in the neighborhood, I'll tell them about this visit on Monday.,,,,,,no review,,
My advice to management: Tell staff to read, slow down, listen and understand how important customer service is.,,,,,no review,,
Advice to Yelpers: Smash Burger or In N Out. Taste hasn't changed, service much better. If in Vegas, Wahlburgers.,1,0pf5VuzE4_1pwj5NJHG5TQ,,,no review,,
I really want to try the siphon coffee sometime.,2,YgavGxfAdjhkkbwlAY_9ZQ,,,,,no review,,
1218,ejaUQ1hYo7Q7xCL1HdPINw,0,2013-05-16,0,Tzh-u5ueYxEx-k2RAXe7cQ,2,i came here for lunch and was rather disappointed with both the service and the food.,,
We were a large party of 8, but the restaurant was not very busy and service was still slow. The waitress had to be asked multiple times to bring napkins, etc.. and didn't really check in. Even getting the check and getting out was slow.,,,,,no review,,
The food took a long time to come out. I had the pulled pork tacos and was very disappointed. They were SO greasy and didn't have a ton of flavor. I got the bottom of the barrel fries, which did not impress either.,,,,,,no review,,
I wanted to like this place, but would not recommend it based on my experience.,0,djSJ6a9gsLSdj-7BoyNNQA,,,,no review,,
2268,egLYFnycp8ktxMCvilFdLw,0,2017-08-14,0,wH9ba46MH8dYb-m8pT3guA,5,john's place is:,,
* Fast - I was in and out in less than 10 minutes.,,,,,,,no review,,
* Friendly - I've never met someone so genuinely kind and interesting all in one go. And he loves taking photos, so the experience becomes something special.,,,,,,no review,,
* Fantastic - The photos are fabulous. He really does a wonderful job making sure you leave satisfied. ,,,,,,,no review,,
Get to Chinatown, climb the stairs up to the studio, and you'll have the best looking passport photo you're ever going to find!,1,XoiBk3HfY0F5WSBgDPZFog,,,no review,,
Still hungry, thirsty, and well-deserving of a baby-break, we backtracked to longstanding Leslieville institution Velvet, and were warmly received.    ,,,no review,,
BTW, I parked my baby stroller next to the owner's scooter by the back booth.,3,xAM4wCIVwH2k7_y8eayNYA,,,,no review,,
717,Swezz8vG_9woCkV30kdgKA,0,2012-03-07,0,RMB8LFNBKlWML_A_jS-yMg,4,i love it here!,,
But you really need to order the all you can eat because the portions on the plate of meat are too little for the amount you're paying.  The all you can eat is around $25 / person & everyone at your table has to eat all you can eat or no one can order it. If you order the all you can eat then you don't have to pay extra for rice (which you really shouldn't have to do if you put in an order for meat--but that's just my opinion).,,,,,,,no review,,
Seoul Grill recently revised their menu, so there are more options for different meats. They have added different flavors, which are so yummy! Try to spicy pork belly (sam gyop sal) that was recently added it's one of my favorites.,,,,,no review,,
And remember when eating meat first order not marinated meats then order marinated because otherwise the marinated meats taste will disrupt the taste of the not marinated meat.   ,,,,,,,no review,,
I must say it's really nice not having to drive to Koreatown for a decent korean bbq place!,,,,,,,no review,,
Oh and all the people who work here are so nice & helpful! I wish they would make a Seoul Grill in Surprise! We need a korean restaurant in Surprise!,2,WgbbxTRIy7MwDKn7nL5WKQ,,,,,no review,,
2237,lIdzQkSWB8HpX0ac4isKnA,2,2012-05-11,2,sQJH9sibaB8YiEiE4-Rysg,5,first of all, Pico Madama has the Moxie crew but is in a new location. Very professional as always. The salon is very clean and somewhat retro. ,
My husband has been going to Ama for about a year now for his hair cuts. He will not go to anyone else. She is very meticulous and always does an incredible job. I finally took his advice and had a haircut done by Ama yesterday... I am amazed by the quality of services she rendered!! She understood exactly what I was looking for. I had a gloss treatment done as well and now my hair is as shiny, healthy, and lustrous as it's ever been.,,,,,no review,,
I would absolutely recommend Ama if you are looking for a quality haircut!!!,2,hvZ5o9YNJJ-TVCcdT42VoQ,,,,,no review,,
-/+ Service is a 50/50.  Some baristas are awesome, some I'd like to slap back into reality.,,,,,,no review,,
- Prices suck.  At 3 Roots I tried the pita/veggie plate and it was definitely not worth the nine bucks.  A few slices of carrots, broccoli and celery, a dab of hummus and a stale pita.  Gross.,,,,,no review,,
+ Vanilla latte.  At least they know how to make the most generic latte in the world.,,,,,,,no review,,
- I once tried their Irish cream.  I will never again ask for anything that sounds fancy.,3,dnSBTYaCnKk_zxjAic1QEQ,,,,,no review,,
243,Ex1-tKlQa74J0usZVHxYEw,0,2012-08-30,0,0L8hqmX03h3CsNvsp4pk6w,5,hands down this place offers the best children's swim lessons in charlotte-- and i know because we have tried what seems like all of them!,,
The indoor pool area is great, with shower facilities and a locker room that are clean and a good temperature for freezing kids getting out of the pool.  The pool is an Olympic sized pool and is not kept freezing (like at MAC) but is cool enough for the children not to overheat.  The deep end has a ledge around the sides that the children can stand on while receiving instruction.  There are several diving blocks they practice on as well.  The seating is great... concrete bleacher-like seating that is in the pool area and divided by a smallish wall.  While the area does have a strong chlorine smell, it is nothing like other area YMCAs that have the indoor pools and water parks... my eyes do not sting while there nor do my clothes smell when we leave.  And, while it is warm in there (thank Goodness!), it is not sweltering.  The parking is awesome here.  There is never a crowd.,,,no review,,
We will be there this Winter doing their little Winter league swim team.  Look for us, I will be the mom reading her book on the concrete bleachers and my daughters will be the ones splashing around and having a blast!,4,OQT9DjfBrzrwOEdVJjuYIA,,,,no review,,
2245,CHW_DPKnTqudyRaDa4vwkg,0,2011-10-05,0,5Qu2S5FWyXz1pp1s55AbZg,1,this mcdonalds needs help...,,
I used to travel alot and Mcdonalds was always the go to fast food restaurant for us. Always consistant food and fast convenient service.,,,,,,,no review,,
This branch is a very poorly run store. The last few times I have gone thru the drive thru the man taking the order was very rude. (the same person i think).. Could not seem to awnser any questions or be polite in any such way. And the food was sub par.,,,,,,,no review,,
Two nights ago, we went to grab a quick snack wrap.. We were greated by a big man who had a very poor attitude. I thought maybe he was just having a bad night?? As we pulled to the counter to grab our order a car from the drive thru went around us to leave. He actually yelled at the man who takes orders that he needed to learn how to treat customers. I then knew that the rudeness that was suspected was not just my imagination.. ,,,,,,no review,,
Tonight was the absolute last time I will ever go here.. We went thru the drive thru around 12:00 AM and for some reason the man who normally takes the order said that they would be closed for 15 minutes for a break??? This is supposed to be a 24 hour location. I wasn't sure if he said 15 or 50 minute break so I asked him when they would re-open to have him yell 15 back in the headset? Some seriously bad service. ,,,,,,,no review,,
I will pass the word on that this location has inconsistant food and horrible service. The management at this fast food branch should be fired as well as the employees who seem to think that yelling at customers and treating them poorly is okay to do.,0,hvZ5o9YNJJ-TVCcdT42VoQ,,,,,no review,,
276,_zTW9DhfQxU7HaVAu-Tsmg,0,2014-12-16,2,mIyMereUwhex_nDr63YOAg,1,went in looking for a good knife, as an Xmas gift. ,
Got talked down to by the fat/balding guy behind the counter (son of the owners?), saying the good knives (which were fully within my expressed budget) were for higher class people, even mentioning every few minutes that all the kitchen stuff was final sale and he didn't want me thinking about a refund.,,,,,no review,,
This literally happened a few hours ago. I've been there in the past, but unfortunately never had the pleasure of interacting with the lovable son.,3,sOuFzmgPBoZO_da0ao0MXg,,,,no review,,
Will definitely be back & spread the word,4,O0CQYDI5_Pz6rqfvjs3IdA,,,,,no review,,
2134,zkhBU5qW_zCy0q4OEtIrsA,0,2011-01-04,0,cAgWNBmRhx4OYwzJ2YzJJQ,2,i had lunch at here. so no lobsters or oyster seafoods highlight. if you select specific foods, it is ok. I have to narrow down to following: ,
In sushi: salmon, eel, shrimp roll,,,,,no review,,
In grill: yaki soba, shrimp tempura ,,,,,,no review,,
In desert: green tea soft ice-cream, mocha cake, and of course fresh fruits,,,,,no review,,
I didn't try all but may be 80%.  Many others i cannot recommend unfortunately.,0,ggUIxd2V8ryLPYUYJUBEaA,,,,,no review,,
Service is always friendly and helpful, reasonably quick, and they don't use a microwave to heat up your samosas - which some other Indian restaurants do in the area. Ew. ,,,,,no review,,
I've had curry bowls from here in the past and like everyone has said, the curries are quite bland.  They are spiced but not really (especially if you've gotten used to more authentic little India flavours) and just generally have a healthy flavor to them. it's not terrible, but miss-able. ,,,,,no review,,
I'd recommend the vegetable samosas instead (or get the spicy lentils as a veg dish for a closer to normal level of spice.) They do bake them - so they aren't deliciously deep fried, but still the filling is nice.,,,,,,no review,,
They've recently upped the price of the samosas, but 3 samosas and two chutneys will still only run you just under $5.,2,YgavGxfAdjhkkbwlAY_9ZQ,,,,no review,,
I know some people aren't into the butter flavoured topping that AMC has going on, but I love that it's available. Not that it's in anyway good for you (mmm soybean oil...), just that all signs point to its veganness, which works for me.,,,,no review,,
As with every movie theater, they will gouge you at the concession, and make you wish you had the foresight to sneak in your own snacks.,4,YgavGxfAdjhkkbwlAY_9ZQ,,,no review,,
2266,QfIJFYIVeZQ3phDJ96JRmw,0,2017-08-15,0,ufRC-QtDN3MCiB1Q1xV16A,4,as a recent transplant to to, I was worried about finding the right shop to process and purchase film. THIS IS THE PLACE! ,
Because I'm strictly a film photographer, I was looking to find a store that would offer great support in terms of my analog needs. I tried one other place in the city and was disappointed by their crappy customer service and the fact that they kept their film stock hidden away from view. ,,,,,,no review,,
Not at Downtown Camera. With a wall made of vintage cameras and a range of films right out in the open, I knew this was going to be a good fit.,,,,,,no review,,
Not only do they have E6 outlab services, their turnaround time for film processed in-house is quick, and you can receive text or email updates to know when your film is ready. And they offer a punch card (for in-house developing only) to keep track of the film you've dropped off -,,,,,no review,,
 once you've hit your ninth roll, your tenth is free! ,,,,,,no review,,
