Unnamed: 0,business_id,cool,date,funny,review_id,stars,text,useful,user_id
4032,4iFYsHDzkuf3JjSzhaNd2g,0,2013-03-31,0,RkQ6Kaz5zUB04XEDKVDsBQ,5,i am so happy with shane co. they have exceeded all of my expectations. since i purchased my first piece of jewelry 4 years ago from shane co i now refuse to shop anywhere else. the quality of their work is phenomenal. they have gone above and beyond for me and saved me a lot of heart ache. thank you aaron (manager) for all of your help and for making every experience with shane co. a wonderful one!,0,vX06zW6rsonnhXxXQq61IA
4033,KFC7mrcdUUeS0ueUCayyEA,0,2015-04-13,0,GCt3N2mFhq6aOH9flF5_3Q,5,we reserved a bollywood private dance class to celebrate a friend's birthday. the staff were very nice and friendly and gave us an acceptable rate. the instructor was half an hour late so to compensate they gave us more time and charged us almost half the rate. the next day they also sent an apology email which was very sweet and professional from their side! the instructor was fun and flexible. we all had a great time and would definitely refer them.,0,8Du42UNHof7va5isCFtOig
4041,K1xLoyHmmkaOKIXs2FUVeA,0,2015-06-12,0,3YH6-r5Y1kM7QOW_PSyzug,1,can you say bed bugs?! my boyfriends uncle stayed there for two weeks and came back with bed bug bites all over him!! . i understand it's a weekly  but damn clean your shit!!!,0,gpqjvuBvOeyZPCPRAgLIjQ
4043,qJ18IGaDsQtzJ6v2UzkdcQ,0,2015-09-12,0,Ttx4ARBmmilWdLX8xYqB6g,4,i tried this place for the first time tonight and was very impressed! i normally would go to panda express but their quality has gone down so much i decided to come here! what a difference! orange chicken is very tender compared to pandas crunchy dry orange chicken.. plus you get so much more food for the same price of just a meal with 1 side at panda. definitely coming here from now on!!,0,gpqjvuBvOeyZPCPRAgLIjQ
4045,w55IYhyLHUdsRlo_EvMmNQ,0,2015-09-06,0,K6ns6Us5pzXQL4L01vUz4A,3,the food is great.. but i feel like the service and quality has gone down since i came here a couple months ago. food took a lot longer than the last time. they seem really short staffed for a saturday night. couldn't even get a togo box for my pizza.. got offered a piece of foil instead.. love this place but i just feel if they tried a little harder to make the guests happy; they would get better business.,1,gpqjvuBvOeyZPCPRAgLIjQ
4050,FczpP53EAcXsfIQMxp9p4A,0,2015-03-17,2,QoYiWOqoG7xlfqqGb2yIXQ,1,i'll give it a 4 star for their service.. but a 1 for their haircut. my boyfriend went in for a simple buzz cut and it is so uneven i wanna make him go somewhere else to fix it cause it looks so bad. everytime he comes here they can never give him a nice even buzz cut.. lol how hard could it be?,2,gpqjvuBvOeyZPCPRAgLIjQ
4070,cT1eYUOjz5CgvZJuxu87sg,0,2014-08-23,0,HM7_PYpcBWZSmIhTc-RH7g,5,great service! friendly atmosphere! lisa and her staff were absolutely fabulous and i am so happy with my nails!,1,ciL5golE8-RciDds1aLuvQ
4072,nPBG-UbMHDMdcnW-HncZNA,0,2017-10-08,0,WqBFKvWv_TidKuoNaBriAw,5,great service!! servers are so nice and food is excellent. my favorite so far is the lemon pepper and the waffle with the butter syrup.  we'll be going back to try the other flavors.,0,a8MX0cLVen-blp1Zk7-MpQ
4079,oWTn2IzrprsRkPfULtjZtQ,0,2015-12-06,0,43qSYZ1Y-odC3n4vjy8O9A,2,the burger was ok. not what i thought after reading and hearing about this place. very small a couple of stools. the cashier needs to learn manners. really for what you get its over priced. the only good thing was the chilly chesse fries. i would go back for them again.,0,M6-4hwoPdMjaIEjlYsaZ8w
4082,ejmQEtYs7lNGh3-w5RIUYQ,1,2014-11-22,0,bQSHL7zt_s78k66AAG1n8w,5,ros does a great job identifying what hair cut and style goes best with facial structure.  i highly recommend her!  she is also a fun-loving spirit.,1,tm0fDqTI2o1nxw0KC68wAg
4083,bjGp5sKsrE9_tWKCw1pBtg,0,2017-02-23,0,0-BjaNbd5E5Dk-EiDTQSrw,3,this was just o.k. no french fries? it's a bar!!! seems like they are going for a organic food bar?,0,tm0fDqTI2o1nxw0KC68wAg
4090,MYMoho8uONfkTvaVNL-pVQ,0,2017-03-27,0,yuWuPzYfXNpSAqeon7F0OQ,5,great food great service. my wife and i had breakfast here over the weekend - coffee arrived at the table in record time and breakfast followed soon after.,,
The portions for the bunker (corn beef hash) are large enough that we each had a midmorning snack later in the day.,,,,,,,no review,,
We've been in a number of times over the years and I've always been glad that we've stopped.,0,4pVwuNpFwn8nWrSkT0urvA,,,,,no review,,
4096,iBVKoqOqe46J3h8ny9m0YA,0,2017-03-09,0,WZRZzTdfgV664Rw4bh6ndw,5,the volunteers here are fantastic and very knowledgeable. the trails are clean and it never really seems to be busy.,0,0Rp6doDKbnLp82-jbbEpcA
4097,VsRAIb4k5CjEF-3l_bac0g,0,2017-06-10,0,NhtVr1V2H38QxzVQRBouDA,5,fast delivery and nice staff. food was delicious. pizzas were on the large side. will order again.,0,0Rp6doDKbnLp82-jbbEpcA
4099,R9Q2H4XVCiHUee3OvkB1kg,0,2013-02-23,0,JAOEpEbfDq5OY0iYtn_D_Q,5,hands down the spot to grab a coffee in the city. i feel so spoiled to have a clover machine and these tasty beans so close to home!,1,CkhsKv_TG_BsfZvPOXeHzw
4102,L3dAvYkqMsLhyPLoeJgwsQ,0,2014-12-31,0,gMCEz_Rc5zK3N8qfIHWI5Q,1,late night breakfast.... not so great. i was crazy excited and then received the food. horrible. coffee good food not so much! :-(,0,gUMujTWJz5ccdYSnPfdB7w
4103,3DLSWOjkNgJHkv3Ti-bgLQ,0,2017-09-22,0,xn1jFii8Gv9EWjOGS-SCFg,1,starbucks here was awful. snooty crew and not friendly at all. i think they choose who to be friendly with because i see them treat other people a lot better.,0,MzGLuKeRON8OE6lLlTiAVQ
4104,6lgRm13PvA6iMGc7PmqK9Q,0,2017-08-02,0,EDXqkuyrvt5vM6EDmZon4w,5,the best 'snowflake' i've ever tasted! it's like heaven in a bowl. oh and the owner was the nicest person you will ever meet! he made us a sample of their pong shake and it was really delicious! i would definitely come back and try other flavors and will get all my friends to try them.,0,MzGLuKeRON8OE6lLlTiAVQ
4109,X_EBs3ShGJmehqzfuciEAA,0,2016-03-28,0,lN_j2PEzgSVckY9gbMXZ8A,5,mike and the cook both deserve 5 stars. i could could on and on but yelp would delete my post so yeah so it is what it is. mike and the cook all 5 stars. bless up,0,SYx15p4PssSS3lXjvtF6rg
4111,-yApKLEFAvvNyifvpNKWCA,0,2012-12-03,0,dSra4Z3XUIJ366fIY4nWzQ,5,a great vegas tradition... it helps that i love frozen custard.  definitely worth a trip for tourists.,0,INbqkFXtHeCdEP_wPp2dUA
4114,3kdSl5mo9dWC4clrQjEDGg,0,2012-12-03,0,iwmUoM9o87tL96Wbdm-zsQ,4,total breakfast fan here and this is one of the few in las vegas that truly does breakfast right.  prices are pretty good and there are always coupons to be had.  love the pumpkin banana pancakes and carrot cake french toast in the fall!,0,INbqkFXtHeCdEP_wPp2dUA
4117,V9OIBO95GDFRvQMcKsNT2w,0,2013-02-24,1,m8-ncyA0lrEkEjLL0C0Pdg,1,absolute let-down. carrot cake was dry.  salad choices are more limited than subway.  service is just so-so.  definitely skip this one.,2,INbqkFXtHeCdEP_wPp2dUA
4121,i3mZIwNi1EiJ7-1A8amoyw,0,2013-01-03,0,4wv4J4An-bYr5hjs2Xe1zQ,5,great middle eastern deli with several vegetarian choices.  very inexpensive and extremely friends staff.  baklava is a must.,0,INbqkFXtHeCdEP_wPp2dUA
4122,HUWLnKD5LSZY134amUO2Rg,0,2012-12-03,0,EpTolIqsQN-n_7fvglx0aA,4,great lunch specials.  good new york godfather feel to the place.,0,INbqkFXtHeCdEP_wPp2dUA
4125,eZcCFV-8X91ZSnmB9807bw,0,2012-12-26,0,TmbCM_nailoOo4EKt4-t1A,4,great service.  good food. monster portions and a menu that goes on forever. just your typical cheesecake factory.,0,INbqkFXtHeCdEP_wPp2dUA
4128,qsJkjQoM3Hdg6Gtqp2S9_w,0,2012-12-03,0,kHv-ZxGZZeLRCFbMxyWf5A,5,pad thai with tofu was real good and flavorful.  prices were very good.   it's one of the few restaurants in vegas that doesn't feel designed for tourists or as an afterthought.,0,INbqkFXtHeCdEP_wPp2dUA
4129,YCEZLECK9IToE8Mysorbhw,0,2013-01-03,0,-1a7DLqgCV_s8Inzr0T7Dw,4,very small portions but good food nonetheless.  healthy places like this are few and far between in vegas.    very yuppie crowd.,0,INbqkFXtHeCdEP_wPp2dUA
4130,PyrcymoNDAJDm_Zn9yl-7A,0,2012-06-08,1,dZiLJlMWA3LnPgeA5RM85A,5,good and authentic.  what it lacks in ambiance it makes up for with taste.   and yes the credit card machines are working again.   i'm an army brat who lived in germany many years and the schnitzels and spaetzle took me back in time.  (get it with rahm sauce).,0,INbqkFXtHeCdEP_wPp2dUA
4131,4qG3Gh8QyugC1XvoTlmgcQ,0,2015-01-18,0,wX3O8W2mClsyIXd9e5EUYg,5,this place is back up to snuff for me.  the trick if you're a pancake lover and picky is to ask for them to make them very thin. improves the blueberry to batter ratio significantly and improves the taste.  the staff is much better than they were for a while. back to loving it.,0,INbqkFXtHeCdEP_wPp2dUA
4134,19VNsxhnPZ11zc0KBauonQ,0,2015-02-03,0,iXEO9493AVcDZmOkGJpIgw,1,worst customer service.mainly the manager matt. who made it very difficult to return a damaged product sold at that location.,1,z7dWikbkqL7NelG4JeSt4g
4139,mdAY2mCRiaOKn3BONyTG4g,0,2016-02-01,0,y_O_XhR1lEv342YoPXttJQ,1,dirty room and huge roaches!!!,,
Stay at 3 Palms in Scottsdale its about 10-15 min away with bar by the pool and nice clean rooms,0,I_2TkQR085ZjsTMRj-XebA,,,,,no review,,
4140,RESDUcs7fIiihp38-d6_6g,1,2014-04-15,0,XeA3BGOhduTRdnprL4ULGQ,4,best buffet i experienced in vegas! you have to be open minded to trying new and gourmet foods very ethnic foods. everything was cooked to perfection! it was very spendy but worth every penny!,1,yvlRColhqo_4TzpUFKyroA
4141,ijg7qQCYnhUWBd5JUxbfvA,0,2014-04-15,0,J5nctRtC0L5oSExNj1XGEA,4,yum! love the atmosphere the food was awesome we came back a 2nd time while staying at the hotel! fun flash back in times prices were affordable ;),0,yvlRColhqo_4TzpUFKyroA
4142,YJ8ljUhLsz6CtT_2ORNFmg,0,2014-04-15,0,1xlYVWhyLedoA0HddOJMOw,4,very great atmosphere had a wonderful bartender so much that we came back to eat and it was awesome food spendy but worth it! thanks matt for the homemade sangria!!,0,yvlRColhqo_4TzpUFKyroA
4143,ByFMv3p5X1aNeZhU61rDcA,0,2014-04-15,0,eBxGjZkwr6qNxyfh2wf_UQ,3,just spent 4 nights here the room was nice we were asked if we would like to be upgraded for a additional fee of $25 a night and ended up paying over $200 additional! so don't be taking in like we were thinking it's a great deal! i did enjoy the suite ;) just not the prices! and skip the buffet it's gross but roxys dinner has excellent food!,1,yvlRColhqo_4TzpUFKyroA
4144,3xmfT7l3xNH5LK1dLzfvGw,0,2014-04-15,0,xKoiChS7y0Ab0sEGbXIICw,4,everyone told us to visit freemont street while in vegas and you sure get a eyefull of live entertainment! it's fun for adults not a place to bring children really why would you bring kids after dark to vegas anywhere really? anyways had a lot of fun here!,0,yvlRColhqo_4TzpUFKyroA
4145,4mYPOzBokDgz307TW2EIKw,0,2014-04-15,0,9h4RxO0QLxvXNqzqyZTA8A,1,it was overly priced for food that looked like it sat there all day! dry meat and not a lot of choices! i couldn't even make a decent salad! worried about even trying the fish and the deserts looked gross!,0,yvlRColhqo_4TzpUFKyroA
4146,rTS8LsUmNIiXsXydE49tPA,0,2014-04-15,0,WP5487GT3BxCqB-tPpJEmw,4,live entertainment as we were served beverages it was so much fun one if the best memories we had in vegas! jaw dropping!,0,yvlRColhqo_4TzpUFKyroA
4156,qMJyOW1FdPOf8sli8DIq_A,0,2015-01-10,0,dGCac3rFvfsxmabrMLcf8g,5,delicious crepes! delice has the feel and menu for an authentic bistro. this place will be a great breakfast or lunch spot. i appreciate any place that has fresh juices! mill ave is lucky to host this business.,0,FfqX7xdQY80nbkdNoeh_6Q
4170,2mZGnGIMUNRQY3d0hjdAxg,0,2015-11-19,0,D3ZNXi428GuMZrnP6FAWkA,5,update - i went to this place on halloween night with friends. i was amazed to see the staff managing the crowd so well. i had never been to tacorrito in the evening. loved the fish quesedilla and mexican poutine. i highly recommend this place to everyone. places like these should be encouraged in the neighbourhood !,0,Ndl1ZwGIsc5oq0qlmbO_AQ
4172,m65oi2C7b1CJM7DaXbFi-g,0,2015-11-19,0,vHvADqKb_2b1vs3zrsHaGQ,4,came in at a busy time and had to wait for a while to get seated. that's the only problem i face here during weekends.dessert was so delicious that it was worth the wait. i would recommend everyone to try it at least once. i am posting few pictures as well.,0,Ndl1ZwGIsc5oq0qlmbO_AQ
4173,Ae4ABFarGMaI5lk1i98A0w,0,2015-11-06,0,-8_zuSnWhyaJwGyCBlu4NQ,4,i visit this place whenever i crave for spicy chicken momos with gravy. i have not come across any other place in toronto which offers momos as good as this place does.,,
I wish ambience could be a bit better but the staff is so friendly that you won't think twice before going there.,0,Ndl1ZwGIsc5oq0qlmbO_AQ,,,,,no review,,
4174,2GIuCQJ9vfMY7rERB-SkUA,1,2012-03-31,0,yvO94hAR0Sx9gdIfy4WSXQ,5,flowers by renee has some of the best quality flowers in town. they are prompt with orders and they are always beautiful,3,HgFcyjBaNI4EiGq-gdS4Dw
4175,d4z4gjdhQYs-WOVClISf_A,0,2014-08-06,0,BwBGme-CKocxzWDpEVyyBg,5,i had one large tree and 4 small bushes removed from my front yard. the quote i received was very competitive and reasonable. the work was done exactly when they promised and they left the area in great condition when they were done. i would use them again in a heartbeat.,1,TE19WORpOSfHegKFkKsXsA
4176,xk-fOf_M39kDTgzfVgu0Tw,0,2016-09-24,0,oUyAKw5-Q0-e17YcqiBNFA,5,went there today for a gluten-free lunch. had the signature pasta with quinoa pasta and chicken it was awesome!!  i highly recommend it.,0,JGpwdNCD1lZFkpPZbcqSOw
4184,h19bR52xQ9fQWGMTSbjnbw,0,2014-03-03,0,3jnl5tE2BaYYQIWWnVQ3eQ,4,the food was amazing. it was something new that i had never tried before. the taste was authentic and homemade. other then the taste of the food the most compelling aspect was the friendly waiter. she was very kind and enlighten.,0,r3u9y04v1ONr-JR-lio34A
4185,GAKCd5eIPQ-_B0psppX81g,0,2014-11-08,0,jYYz9T5OvAWbZUdtsZAsQA,5,i was highly satisfied by my haircut. my hair was the best it ever look. laura did an amazing cut. would definitely come back.,0,r3u9y04v1ONr-JR-lio34A
4186,XsSgv3vBOyOBXn3Co8EVIg,0,2014-03-10,1,2h_G9uwqcBMYg8v_LZyGEQ,5,this place was great. the wings were the best i had and the pizza had the most stretchy cheese. :) always best eaten hot and never warm. ^^ i also liked the rice dishes. you won't be disappointed.,,
The environment is more of an urban and youth theme. I really enjoy listening to the pop and kpop while enjoying my meal. The art was also nice too. A great place with friends and maybe dates ;),0,r3u9y04v1ONr-JR-lio34A,,,,,no review,,
4187,u0wSFmWfg7IFJRl-WdSrNQ,0,2016-07-31,0,YSHInoiOGZ_kYSypKFZ0Jw,2,super cute place but slowest service ever! don't come here unless you have a full day to spend waiting for your (small & simple) order,0,jjDkYVZkU55697Xk_FOHKw
4196,l-UsKevA9YyOM4wGtS5gGw,0,2016-09-12,0,Gl1zXZzQXFuLSoT_YKUBAA,1,pumped my gas and self paid outside.  went into the store to buy a drink...  returned to find gas dripping onto the ground and shooting out of my tank! the pump overcharged me ten dollars.,0,T9240z_FiwKZoCtibHZMew
4197,_PfpHaeuekLUGaKKtee2KA,0,2016-07-28,0,sLz4aFFV0Ci_YDKnGQMWMw,5,amazing customer service..before i even walked through the door i was greeted. i came in for an estimate and it no lie took a total of 10 mins. 15 mins max.,0,ic9zIsm7zoxUm3Axyegx8g
4203,wMiOsYLtgwbUoyV2DttqMg,0,2016-08-18,0,rJBnimtD0vPkziwJ83Mh9g,5,so i've been to harris teeter several times but never for lunch. their pizza is better than any chain pizza place. no lie. and their sushi is always fresh and good. friendly employees and there's a starbucks with dining space.,1,ic9zIsm7zoxUm3Axyegx8g
4213,sBrrWO-Nv7imsqU0e5504Q,0,2016-07-13,0,E4S2OJpQorhXbtw0eIhz4A,5,came here around lunch time. i ordered ahead online to avoid the line. as soon as i walked through the door i was greeted by several of the workers. somehow they already knew what order i was there to pick up. oh and the sub hit the spot. as always.,2,ic9zIsm7zoxUm3Axyegx8g
4215,AdtaU4YPa5ejSsepQHfkQA,0,2016-06-09,0,Ocmvx8ZH1cSmo-bm8d675A,1,i called to see if my prescription was ready and see how much it'd cost. after 45 min of holding i just went to the store..just to find out they don't accept tricare. they move super slow and weren't helpful at all.,0,ic9zIsm7zoxUm3Axyegx8g
4218,7LLU_dpe7iN97nJzYmTvjQ,0,2016-07-09,0,cKsCaQ3wd878kFMGy0sDzA,5,i usually get the hibachi chicken and steak. it's really good and affordable. the lady at the register is always nice. i've eaten in like twice and called in for carry out 5+. no complaints with either experience.,0,ic9zIsm7zoxUm3Axyegx8g
4228,fSBhe0A6Dfa8JCYccfpMog,1,2016-03-13,0,XeLWSsEgrS-wY55FhVrxaQ,5,best tasting bagels in arizona and of anywhere that i have tried in the world.  the owner makes you feel like family.  my son loves to go too.,,
My staple - bagel breakfast sandwich with lox.,1,R9sFeYJ4hgpnUYaFk2kp1Q,,,,,no review,,
4231,9a3DrZvpYxVs3k_qwlCNSw,0,2014-12-14,0,vURAQqDU50fj9HM8L88wjQ,5,genova pizza is amazing.  pesto that will light up your palate. potato that smoothes each bite.  italian brick oven pizza crust. simply amazing. go enjoy.,1,R9sFeYJ4hgpnUYaFk2kp1Q
4232,vVvJ0ZilcEw7TKjLRHTJkw,0,2015-06-10,0,ZlYFKkneDMFIUV_vAQ9brA,4,i did a walk-in pedicure and ended up getting a gel manicure as well. cathy took great care of me and did a very nice and quality job. everyone was very friendly. highly recommend this nail salon.,0,4RXC9BnjoABuNxd6rELUbw
4233,QjkA38rDhT_HdN5M31skqQ,0,2017-08-31,0,u_EZI2txD3S89IAj47FCHA,5,tony did an amazing job on my door dings and even buffed a scratch i had. it looks great. highly recommend!,0,4RXC9BnjoABuNxd6rELUbw
4243,-Tq6H24JUsMjZLJBa5YkZg,1,2017-07-29,1,Eh2-dDqkoJ_WEl9Ql7Ru3g,5,i came here to paddleboard with outdoor afro group. we learned how to paddle board and enjoy the beautiful weather. they had an opening tonight with free food and drinks.,1,caV30R9uCewFdvtdhDg3Nw
4244,kRhjWeAPs-U5RmakIKz0Pg,0,2017-07-11,0,wV7vNA4a_Bf1TBTTr9TWSw,4,i went to bingo monday's and had a great time with friends. the lamb sliders are amazing! love the outdoor seating. i would definitely recommend this place if you need something fun to do on a monday night.,0,caV30R9uCewFdvtdhDg3Nw
4246,QeDkfLmXVguytF3Of9zg-Q,0,2017-06-11,0,MCZ0SkGOhVGLrZl42jZiGA,2,the grits were a bit dry/crunchy and the crab cake croissant sandwich was salty. however the mimosa was fantastic! i loved the dinning area. i was able to sit inside but still enjoy the outside air with the windows being open. over the environment is great and the employees are nice but i wasn't completely impressed with the food.,0,caV30R9uCewFdvtdhDg3Nw
4248,1Geg7R5ACFL0oassVziNiQ,0,2017-07-04,0,tDXY4qXQvazciCsmiWI6iw,5,i went to this crispy crepe for breakfast on the 4th of july. it's a cute and quaint restaurant. you have the option to sit inside or out. i ordered the egg and veggie omelette that was nothing but amazing! my side of fruit (melon and pineapples) was freshly cut and delicious. the crepe is huge so come hungry. parking is easy. there's a free parking garage behind the building or you can park on the street. this is definitely a new favorite spot for me. i will be back soon.,0,caV30R9uCewFdvtdhDg3Nw
4252,fIuquIgWrkNEM5yvYSHPgw,2,2014-08-05,0,X4glBKsOvs6fgjHNJ0IUjw,5,what a compassionate and thorough professional.  our family had the pleasure of meeting dr. gilchrist and his associate alex today when they came by to assess our 14 year old dog. this was such a positive experience for our dog to be examined in the security of her home. we were given plenty of opportunities to ask any questions and our questions were thoroughly answered. we will definitely call dr. gilchrist again.,3,xDjaGtx-TZUDdUxRKJnKCA
4255,3pSUr_cdrphurO6m1HMP9A,1,2017-01-01,1,uDgWTAh9VcfbdtwV1Mukqg,5,this place is amazing so much fun!!! i would recommend for any celebration! you have the quietest people getting up and singing. i love this place will be back again.,1,WncPRE2uAJ3eQx4MG6uYRA
4257,hDyc9DdjGldhxis5E1rd3w,0,2017-03-20,0,2_GW45qzk7vqLukTZW5GFA,5,excellent! very fresh and delicious. it's a hole in the wall but don't let that scare you from getting it out.,0,TAOJZgcPSBkJAZb7Wn00ZA
4263,eoG9zP7xxsDHVM0kJYrvkw,0,2016-08-01,0,YtdVGqYtMTOD5e7qEDFrqg,5,absolutely loved this place. we only stopped in for drinks. but the drinks themselves are worth the visit. the dinner menu wasn't very extensive but every item looked thought out. can't wait to come back. the bar staff were very friendly and provided a fun unique experience.,0,ZJrUFhtPyYsHUKUTAbMSEA
4266,zC-RnKVTlGEBmzCngDzp0Q,0,2016-06-16,0,2UB59dG7bPZgVSOCNgZtfA,5,the food was awesome. ordered a few things off the menu and everything was great. korean with a twist. the ribs were phenomenal. great staff and service. closing soon. very sad i check it out so late.,1,ZJrUFhtPyYsHUKUTAbMSEA
4267,ceQE2ktRVBnQsaT5aeOAeA,0,2015-09-26,0,bESHTsjWT4V-gYaZXNV7zg,5,amazing amazing amazing spa! both massage and facial were great as well as the customer service! highly recommend this place!!,0,We0xKzwLt9vhqzus5KPgow
4270,KpgPSQmQDgx3tJ6RlKVCBA,0,2014-12-24,0,sJen3gl5z9NJrtHPWUGtjA,1,recently had pizza and wings plus two drinks. the food was decent but once the bill arrived the thrill was gone. with a good tip our bill hit $60. a bit ridiculous for pizza n wings,1,OyA20DYvFEdlvAnpb5Ifew
4271,MCBsyPnsOn8kOuyCbP2O4A,0,2016-11-11,0,OJwHSTEuN_Lw_tVgRLVkew,2,cannot make reservations in holidays and weekends.  what's the point ... who needs a reservation on monday thru thursday?   gotta laugh at this concept.  :o),2,c2Qj4Dzldeh6k7JcH2xWzg
4283,QJatAcxYgK1Zp9BRZMAx7g,0,2016-01-18,0,pl6G8YCk1OL877yv2vFemw,5,i love shake  shack it's very relaxing and  the people is uplifting and always joyful it's very clean and i love the big screen tv so you can watch your sports it's a perfect setting to be outside or inside i go there all the time,0,1s6BOw2WYb-5fi_R71ifxg
4291,on9Ex8TcopX9lU0JQsuiuQ,1,2016-08-30,0,5kWXMoPja4wknryyZV-_jw,4,love this place! my new favourite ramen house!! the chicken karage with the freshly grated daikon radish is excellent as is the ramen. the cha-siu isn't too fatty but still tender and juicy. the only issue are that there's not a/c so it can get hot inside.,1,fT1rTmiR6mhzL7GMgstvJQ
4304,u8-WDsLXAl0dXQW_wqWrDg,0,2017-02-24,0,JuFAPWieOvXf5n_tMhE6HA,1,the dryest burger ive ever eaten.... $40 for 2 burgers and fries and i would rather eat a mcdonald's double cheeseburger.,0,QAkLJ2KZaJAqTi6KEVabWw
4305,QdganL5AW9E_fNoRVroLig,0,2014-03-11,1,wbjm7ChpSB0EbL9Umun2lA,1,had duck fried rice which was full of small crunchy bones. the cashew chicken had a funky odor and the pad thai was horrible. not to mention the restaurant is dirty and condiment bottles are crusty. this place is overpriced for poor quality food. we will not be going back!,1,jNz3ic5TdcDIZJtx7iM5wQ
4306,aokqWHt8vMf5iwj8KZZ5eg,0,2014-04-26,0,JHWWdKmzNUItE_An5u_uJg,5,excellent food and wonderful service! the best reuben sandwich i have ever eaten. and the iced tea is very good and the prices are hard to beat. we will be back :),0,jNz3ic5TdcDIZJtx7iM5wQ
4307,69Gyhl3O04NG6DGAoZ6t4Q,0,2015-02-06,0,n-wkLClD42v3a4fkZzpZrw,5,i love this place... been getting massages there for years and have never been disappointed. become a member for the best price as the ala cart prices are a bit high. gorgeous relaxation room. wish i could recreate that room in my house! and their music is very relaxing. sauna is perfect to ward off cleveland's winter cold. love the staff. they couldn't be nicer.,1,GvjexZRFBYiqNzOmoKHRTg
4308,CuT2Xh3vAYvRfxUWlUo6oA,0,2015-03-18,0,V8yjQpkbl_KVVUM4JZ1D9g,4,i figured the wait on a sunday would be long and it was. 25-30 minutes turned into an hour for a table in the restaurant not a high top at the bar. server was just ok. never checked on us once to refill drinks until we were ready to leave. probably because we didn't order beer. wings were excellent. we ordered dry rub with 2 sides of sauce. hubby's burger (thick rick) and fries were delicious - enough for 3 people! stay away from the bay of pigs cuban pork sandwich. it was nothing like the sandwich described by the pd food editor. unless you like 80% fat and gristle. it was gross... i'd definitely come back but stick with a burger or chicken sandwich.,1,GvjexZRFBYiqNzOmoKHRTg
4312,6i85_hLuAdymNIy01LLl0g,0,2011-08-23,0,_1mEuMVgjJTKzwZ_XVIghQ,4,going to a bbq?? this is the places to pick up your stuff..,0,wNltctNC59TVPXMeDHsM1Q
4313,5PD6FDa_03U6NXrd7E4yGA,0,2011-08-10,0,zxEIqOGx6T-YClLPGwg3SQ,4,i have been here a few times. very time you are here you feel like there is a really big part of nevada's history is here.,0,wNltctNC59TVPXMeDHsM1Q
4315,eqQnIjAAhOUuHqK6gTWRXw,0,2011-06-28,0,1xNdc8jU4_hIqlq9BipJCA,5,the most accomodating gluten free menu on the planet.,0,Auxu_C_QmuyM_DW0jFK_hA
4320,eLMCasvWCkJYDkvkKREz7A,0,2016-05-18,0,H5q1yEGNupwYiTlm8MaakA,4,excellent thai food. we go here at least once a month. the staff is courteous and the food tasty. service is fast. this is great value for money and kid friendly as well. try it!,0,xvbN8gaS6IqrlCOBB9jxnA
4321,RyTKm8McePjwsL8ggEHOYA,0,2016-05-18,0,xjPpR0479Of69GE5MIHk0A,4,love the food! and the location! easy to grab a healthy dinner here before a movie. highly recommend trying me va me out!,0,xvbN8gaS6IqrlCOBB9jxnA
4324,eMTE-wqpk_YWaV3mf7Ii3A,0,2016-05-29,0,34HSLtTg0XjMg-4K_1q28w,4,dinner with friends on friday evening. not too packed and service was great. food portions were a bit small though i loved the korean beef short ribs and the lamb in thai red curry. try it!,0,xvbN8gaS6IqrlCOBB9jxnA
4326,__pTR2Zcmofr_1FpAaQZhA,0,2016-06-20,0,8WyS_dBTt33q6HItper0gw,5,had iftar (breaking the daily fast during ramadan) here on saturday. great food and excellent service. new menu and decor. highly recommended!,0,xvbN8gaS6IqrlCOBB9jxnA
